Job Name,Company Name,Location,Level
Python Developer,CÔNG TY CỔ PHẦN CÔNG NGHỆ ALPHAWAY,"- Hà Nội: 44 Lê Ngọc Hân, Hai Bà Trưng",Trưởng nhóm
Fullstack Developer Python,Công ty CP Khoa học Dữ liệu,"- Hà Nội: Tầng 4, toà HH2 Yên Hoà, đường Dương Đình Nghệ, Cầu Giấy",Nhân viên
Business Analyst,Công ty Cổ phần Công nghệ Alphaway,"- Hà Nội: Lê Ngọc Hân, Hai Bà Trưng, Hai Bà Trưng",Trưởng nhóm
Senior Business Analyst,NGÂN HÀNG THƯƠNG MẠI CỔ PHẦN VIỆT NAM THỊNH VƯỢNG,"- Hà Nội: 89 Láng Hạ, Đống Đa",Trưởng nhóm
Kỹ Sư AI,CÔNG TY CỔ PHẦN CÔNG NGHỆ UPP TOÀN CẦU,"- Hà Nội: Tòa Web3, Số 15 Ngõ 4 Duy Tân, Dịch Vọng Hậu, Cầu Giấy, Cầu Giấy",Trưởng nhóm
Scrum Master,Vega Corporation,"- Hà Nội: 106 Hoàng Quốc Việt, Cầu Giấy",Nhân viên
,Công ty cổ phần Hạ tầng Viễn thông CMC Telecom,"- Hà Nội: Số 11, Duy Tân, Tòa Nhà CMC, Cầu Giấy",Nhân viên
Trưởng Nhóm Kiểm Thử,CÔNG TY CỔ PHẦN ĐẦU TƯ CÔNG NGHỆ HOÀNG HUY,"- Hà Nội: Linh đàm, Hoàng Mai",Trưởng nhóm
ERP,Công ty Cổ phần công  nghệ thực phẩm Châu Á,"- Hà Nội: 69 - Tô Hiến Thành, Hai Bà Trưng",Nhân viên
Business Analyst,Công ty cổ phần Tasco,"- Hà Nội: tòa nhà Tasco, Nam Từ Liêm",Nhân viên
Scrum Master,CÔNG TY CỔ PHẦN FIVE-STAR E-LEARNING,"- Hà Nội: 35 Lạc Trung, Hai Bà Trưng",Trưởng nhóm
Flutter Developer,Wavez Technologies,"- Hà Nội: Tòa nhà Golden Palace, Mễ Trì, Nam Từ Liêm, Nam Từ Liêm",Nhân viên
Technical Support Engineer,Công Ty TNHH Avepoint Việt Nam,"- Đà Nẵng: 2F Vinh Trung Plaza, No. 255-257 Hung Vuong, Vinh Trung, Thanh Khê - Hà Nội: Tầng 4, Artemis, Số 3 Lê Trọng Tấn, Phương Liệt, Thanh Xuân",Nhân viên
Artist,CÔNG TY CỔ PHẦN AZ GLOBAL CORP,"- Hà Nội: Tầng 3, tòa nhà FLC Landmark Tower, đường Lê Đức Thọ, phường Mỹ Đình 2, Nam Từ Liêm",Nhân viên
Senior Frontend Developer Angular,Newwave Solutions JSC,"- Hà Nội: Tòa Mitec, Dương Đình Nghệ, Yên Hòa, Cầu Giấy, Cầu Giấy",Nhân viên
Java Developer,Viettel Digital,"- Hà Nội: Tòa Keangnam, Phạm Hùng, Nam Từ Liêm",Trưởng nhóm
Fresher ReactJs,CÔNG TY CỔ PHẦN OKHUB VIỆT NAM,"- Hà Nội: đường dọc bún 2, phường Văn Khê, Hà Đông",Nhân viên
Business Analyst,Công ty Cổ Phần Rikkeisoft,"- Hà Nội: tòa Vinacomin Dương Đình Nghệ, Cầu Giấy",Nhân viên
Chuyên Viên Phân Tích Nghiệp Vụ Business Analyst BA,Công ty Cổ phần Tập đoàn Song Nam,"- Hà Nội: Tầng 2, Tòa N09B2 Thành Thái, Dịch Vọng, Cầu Giấy, Cầu Giấy",Nhân viên
Project Manager Quản Trị Dự Án Công Nghệ Thông Tin,Ngân Hàng TMCP An Bình,- Hà Nội,Nhân viên
QC,Công ty Cổ phần Funtap,"- Hà Nội: Tầng 4, tòa nhà Tây Hà, số 19 Tố Hữu, Nam Từ Liêm",Nhân viên
Nhân Viên IT Support,CÔNG TY CỔ PHẦN FIVE-STAR E-LEARNING,"- Hà Nội: 35 Lạc Trung, Hai Bà Trưng",Trưởng nhóm
Automation Test,Công ty Cổ phần Giải pháp Công nghệ TTC Việt Nam,- Hà Nội: Cầu Giấy,Nhân viên
Engineer,CÔNG TY CỔ PHẦN CÔNG NGHỆ SAVA META,"- Hà Nội: : Unit 5, Tầng 14 Tòa Nhà Century Tower, 458 phố Minh Khai, Phường Vĩnh Tuy, Hai Bà Trưng",Nhân viên
,Cty TNHH Thundersoft Việt Nam,"- Hà Nội: Toà nhà Westpoint Tower Đỗ Đức Dục, Nam Từ Liêm, Nam Từ Liêm",Trưởng nhóm
Backend Developer,CÔNG TY CỔ PHẦN ZTO LABS,"- Hà Nội: NIC Hanoi, Ngõ 7 Tôn Thất Thuyết, Dịch Vọng Hậu, Cầu Giấy, Cầu Giấy",Trưởng nhóm
Mobile Developer Flutter,CÔNG TY CỔ PHẦN CÔNG NGHỆ ALPHAWAY,- Hà Nội,Trưởng nhóm
Lập Trình Viên Front-End Vuejs,CÔNG TY CỔ PHẦN GIẢI PHÁP CÔNG NGHỆ NEWWAY,"- Hà Nội: Số 74 Hồ Đền Lừ, Phường Tương Mai, Hoàng Mai",Nhân viên
Nhân Viên QA Tiếng Nhật,CÔNG TY TNHH CÔNG NGHỆ AMCOLAB,"- Hà Nội: Audi Hanoi, 8 Phạm Hùng, phường Mễ Trì TP Hà Nội, Việt Nam, Nam Từ Liêm",Nhân viên
Business Analyst,CÔNG TY TNHH VETC DIGITAL,"- Hà Nội: Tasco Building, HH2-2, Phạm Hùng, Nam Từ Liêm",Nhân viên
C/C++ Developer,CÔNG TY CỔ PHẦN AHT TECH,"- Hà Nội: Toà Mitec, Đường Dương Đình Nghệ, Cầu Giấy, Cầu Giấy",Trưởng nhóm
Dự Án Game,CÔNG TY CỔ PHẦN ADNX,"- Hà Nội: Số 20-16B1, Làng Việt Kiều Châu Âu, Phường Hà Đông, Hà Đông",Nhân viên
Game Artist Hà Nội,CÔNG TY CỔ PHẦN CÔNG NGHỆ ONECHAIN,- Hà Nội: Đống Đa,Nhân viên
Quản Lý Triển Khai Dự Án,CÔNG TY CỔ PHẦN TẬP ĐOÀN IVI,"- Hà Nội: Tòa VOV, 35 Nguyễn Đình Chiểu, Lê Đại Hành, Hai Bà Trưng - Hồ Chí Minh: Nguyễn XÍ, Bình Thạnh",Quản lý / Giám sát
Tester,CÔNG TY CỔ PHẦN CÔNG NGHỆ ALPHAWAY,- Hà Nội,Trưởng nhóm
Manual Tester,Công ty cổ phần PayPay,"- Hà Nội: 34 Nguyễn Khánh Toàn, Phường Quan Hoa, Cầu Giấy",Nhân viên
Manual Tester,CÔNG TY CỔ PHẦN DỊCH VỤ DI ĐỘNG THỂ HỆ MỚI (NMS),"- Hà Nội: Tòa nhà Mỹ Đình Plaza, 138 Trần Bình, Nam Từ Liêm",Trưởng nhóm
Net Developer,Tập Đoàn Novaon,- Hà Nội: Cầu Giấy,Nhân viên
Java Developer,Công ty cổ phần Sphinx,"- Hà Nội: Tầng 1, Tòa nhà HL, số 6/82 đường Duy Tân, phường Dịch Vọng Hậu, Cầu Giấy - Hà Nội: Đống Đa",Nhân viên
Fullstack Developer Java Reactjs,CÔNG TY TNHH SAMSUNG SDS VIỆT NAM,"- Hà Nội: Tòa PVI, Số 1 Phạm Văn Bạch, Yên Hòa, Cầu Giấy",Nhân viên
Fullstack Developer PHP Laravel,Công ty TNHH Lisod Việt Nam,"- Hà Nội: FLC FLC Landmark Tower Ngõ 60 P. Dương Khuê, Mỹ Đìn, Nam Từ Liêm",Nhân viên
Mobile Developer Android IOS,Công ty Cổ phần MISA,"- Hà Nội: N03T1, Khu Ngoại Giao Đoàn, Bắc Từ Liêm",Nhân viên
Nhân Viên Tester QC Tester,Công ty Cổ phần Công nghệ Tài chính Goline,"- Hà Nội: 78 Duy Tân, Cầu Giấy",Nhân viên
Fresher Quality Assurance QA,FPT Software,"- Hà Nội: FPT Tower - Số 10 Phạm Văn Bạch, Cầu Giấy - Hà Nội: Hòa Lạc (có xe đưa đón), Thạch Thất",Nhân viên
Chuyên Viên An Toàn Thông Tin,Công Ty Cổ Phần VCCorp - SohaGame,"- Hà Nội: 85 Vũ Trọng Phụng, Thanh Xuân, Thanh Xuân",Nhân viên
Trợ Lý Dự Án,Công ty cổ phần dịch vụ Viễn Thông Sô,"- Hà Nội: Tầng 3, Tháp B, Tòa nhà GreenPearl 378 Minh Khai, Vĩnh Tuy, Hai Bà Trưng",Nhân viên
Lập Trình Viên Android,EZTech & CDT Games Studio,"- Hà Nội: Iris Garden, Số 30 đường Trần Hữu Dực, P. Mỹ Đình 2, Nam Từ Liêm",Nhân viên
Kỹ Sư Hà Nội,CÔNG TY TNHH HANOI BIM CENTER,"- Hà Nội: Tầng 6, Toà nhà EuroWindow, số 27 đường Trần Duy Hưng, Phường Yên Hoà, Thành phố Hà Nội, Việt Nam, Cầu Giấy",Nhân viên
Full Stack Developer,CÔNG TY CỔ PHẦN ĐẦU TƯ TOÀN CẦU GIFT,"- Hồ Chí Minh: 110-112 Nguyễn Thị Nhung, Hiệp Bình Phước, Thủ Đức, Thủ Đức - Hà Nội: HD09-SP.BH-62 Vinhomes Ocean Park, Gia Lâm, Gia Lâm",Nhân viên
Kỹ Sư Hệ Thống Cloud Engineer,Công Ty Cổ Phần VCCorp,"- Hà Nội: Toà Center Building, 85 Vũ Trọng Phụng,, Thanh Xuân",Nhân viên
Engineer Kỹ Sư Lập Trình Nhúng,Công ty Cổ phần Công nghệ Pavana,"- Hà Nội: Tòa nhà The Vista, số 4, ngõ 15 Duy Tân, Cầu Giấy, Cầu Giấy",Nhân viên
Business Analyst BA Nhân Viên Phân Tích Nghiệp Vụ Chứng Khoán Quận 1 Cầu Giấy Hà Nội,CÔNG TY TNHH GROOO INTERNATIONAL,"- Hà Nội: Tầng 5, Tòa nhà IDMC Duy Tân, Số 21 Đường Duy Tân, Phường Cầu Giấy, Thành phố Hà Nội, Việt Nam, Cầu Giấy - Hồ Chí Minh: 3C Tôn Đức Thắng, phường Bến Nghé, Quận 1",Nhân viên
Devops Engineer,CÔNG TY CỔ PHẦN TƯ VẤN CÔNG NGHỆ NGS,"- Hà Nội: 6th Element Nguyễn Văn Huyên, KĐT Tây Hồ Tây, Tây Hồ - Hà Nội: 6th Element Nguyễn Văn Huyên, phường Nghĩa Đô, Cầu Giấy",Trưởng nhóm
Business Analyst,Công ty cổ phần Synodus,"- Hà Nội: 15th Floor CIC Tower, 2/219 Trung Kinh, Yen Hoa Ward, Cau Giay Distric, Cầu Giấy",Trưởng nhóm
Chuyên Viên Phát Triển Ứng Dụng Mobile Developer,CÔNG TY CỔ PHẦN CÔNG NGHỆ ALADIN,"- Hà Nội: Tầng 4, Tòa nhà Văn Phòng HH1 Meco Complex, Ng. 102 Trường Chinh, Phương Mai, Đống Đa",Nhân viên
,Công ty Cổ phần đầu tư Công Nghệ và Thương Mại Softdreams,"- Hà Nội: Nhà khách ATS, số 8 Phạm Hùng, Nam Từ Liêm, Nam Từ Liêm - Hà Nội: Cầu Giấy - Hà Nội: Thanh Xuân",Nhân viên
AI Engineer IT,ORBRO Inc.,- Hà Nội: Cầu Giấy,Nhân viên
Tech Lead NodeJS ReactJS,CÔNG TY TNHH SOFTFLEX LLC,"- Hà Nội: Epic Tower, ngõ 19 Duy Tan, Cầu Giấy",Nhân viên
Automation Tester Hà Nội,Công ty cổ phần Công nghệ thông tin Phú Minh (Phú Minh Teck),"- Hà Nội: Tòa Keangnam, Phạm Hùng, Nam Từ Liêm, Nam Từ Liêm",Nhân viên
System Admin Quản Trị Hệ Thống,Công Ty Truyền Thông Và Công Nghệ ICOMM Việt Nam,"- Hà Nội: 48 Tố Hữu, Nam Từ Liêm",Nhân viên
React Native,Công ty cổ phần Synodus,- Hồ Chí Minh - Hà Nội,Trưởng nhóm
Frontend Developer,CÔNG TY CỔ PHẦN ZTO LABS,"- Hà Nội: NIC Hanoi, Ngõ 7 Tôn Thất Thuyết, Dịch Vọng Hậu, Cầu Giấy, Cầu Giấy",Trưởng nhóm
Quản Trị Hệ Thống System Engineer DBA,Công ty Cổ phần Đầu tư Phát triển Công nghệ và Truyền thông,"- Hà Nội: Tầng 2, CT2 Tràng An Complex, số 1 Phùng Chí Kiên, Nghĩa Đô, Cầu Giấy, Cầu Giấy",Nhân viên
,Công ty Cổ phần Giải pháp Công nghệ TTC Việt Nam,- Hà Nội,Nhân viên
,CÔNG TY CỔ PHẦN OMINEXT,"- Hà Nội: Tầng 13, tòa nhà 789 số 147 Hoàng Quốc Việt, Cầu Giấy",Trưởng chi nhánh
Project Manager IT Hà Nội,CHI NHÁNH TẠI THÀNH PHỐ HÀ NỘI – CÔNG TY TNHH REERACOEN VIỆT NAM,- Hà Nội,Trưởng/Phó phòng
Test Engineer,Công ty Cổ phần Công nghệ KiotViet,"- Hà Nội: 1A Yết Kiêu - Phường Cửa Nam, Hoàn Kiếm",Nhân viên
Kỹ Sư Cầu Nối BrSE,Newwave Solutions JSC,"- Hà Nội: Tòa Mitec, Dương Đình Nghệ, Yên Hòa, Cầu Giấy, Cầu Giấy",Nhân viên
Manual Tester Kiểm Thử Phần Mềm,CÔNG TY CỔ PHẦN STRINGEE,"- Hà Nội: Tầng 17 VP 2, Tòa nhà Sunsquare, 21 Lê Đức Thọ, Nam Từ Liêm",Nhân viên
Product Owner,Viettel IDC,"- Hà Nội: 85 Vũ Trọng Phụng, Thanh Xuân, Thanh Xuân",Trưởng nhóm
Software Developer,Asilla Việt Nam,"- Hà Nội: ố 6 ngõ 82 Duy Tân - Dịch Vọng Hậu, Cầu Giấy",Nhân viên
Lập Trình Viên Backend NodeJS,CÔNG TY CỔ PHẦN HTN SOFTWARE,"- Hà Nội: Số 190C4 Nguyễn Cảnh Dị, phường Đại Kim, Hoàng Mai, Hoàng Mai",Trưởng nhóm
Java Backend,Công ty TNHH Dịch vụ công nghệ TP,"- Hà Nội: Tầng 2 tháp A, Toà nhà Rivera Park, 69 Vũ Trọng Phụng, P. Thanh Xuân Trung, Thanh Xuân",Nhân viên
Java Backend Techlead Chứng Khoán,CÔNG TY TNHH CHARTERTECH GLOBAL,"- Hà Nội: 265 Cầu Giấy, Cầu Giấy",Trưởng nhóm
Lập Trình Viên,CÔNG TY CỔ PHẦN PHẦN MỀM THĂNG LONG,"- Hà Nội: Tòa Diamond Flower, 48 Lê Văn Lương, Thanh Xuân",Nhân viên
Reactjs Developer,CÔNG TY CỔ PHẦN DỊCH VỤ DI ĐỘNG THỂ HỆ MỚI (NMS),"- Hà Nội: Toà nhà Mỹ Đình Plaza, 138 Trần Bình, Nam Từ Liêm",Trưởng nhóm
IT Project Manager,CÔNG TY TNHH TIMIND,"- Hà Nội: Tòa FAFIM A, 19 Nguyễn Trãi, Thanh Xuân",Quản lý / Giám sát
Project Manager,CÔNG TY CỔ PHẦN TRUYỀN THÔNG VĂN HOÁ VIỆT,"- Hà Nội: Tầng 3, Tòa Tháp Đông, Chung cư Học viện Quốc Phòng, Xuân La, Tây Hồ",Nhân viên
Lập Trình Viên Back-End,CÔNG TY CỔ PHẦN FIVE-STAR E-LEARNING,"- Hà Nội: 35 Lạc Trung, Hai Bà Trưng",Trưởng nhóm
Trưởng Nhóm,Công ty Cổ phần Tập đoàn Meey Land,"- Hà Nội: 97-99 Láng Hạ, Đống Đa",Trưởng nhóm
Frontend Developer,Công Ty TNHH Townsoft Vina,"- Hà Nội: Số 3 - A24 Ngõ 385 Hoàng Quốc Việt, Phường Nghĩa Tân, Cầu Giấy",Nhân viên
Tester,BSS Group,"- Hà Nội: Toà Viwaseen, 48 Tố Hữu, Nam Từ Liêm, Nam Từ Liêm",Nhân viên
Chuyên Viên Vận Hành Hệ Thống,CÔNG TY TNHH MỘT THÀNH VIÊN CÔNG NGHỆ VÀ THƯƠNG MẠI WIINVENT,"- Hà Nội: 96 Hoàng Ngân, Cầu Giấy",Nhân viên
Kỹ Sư,TẬP ĐOÀN CÔNG NGHIỆP - VIỄN THÔNG QUÂN ĐỘI,"- Hà Nội: Tòa nhà Epic, ngõ 19 Duy Tân, Cầu Giấy",Nhân viên
Full-Stack Developer,BSS Group,"- Hà Nội: Toà Viwaseen, 48 Tố Hữu, Nam Từ Liêm",Nhân viên
Quản Lý Dự Án,Công Ty Tài Chính Tổng hợp Cổ Phần Tín Việt,"- Hà Nội: 98 Hoàng Quốc Việt, Cầu Giấy",Trưởng nhóm
IT Comtor Tiếng Nhật,Công TY TNHH FLINTERS Việt Nam,"- Hà Nội: Discovery Complex, 302 Cầu Giấy, Dịch Vọng, Cầu Giấy, Cầu Giấy",Nhân viên
Ads,Zitga studios,"- Hà Nội: Tòa nhà Toyota Thanh Xuân, số 315 Trường Chinh, Thanh Xuân",Trưởng nhóm
Developer,CÔNG TY TNHH ZINZA TECHNOLOGY,"- Hà Nội: Toà nhà Hoàng Ngọc, Ngõ 82 Dịch Vọng Hậu, Cầu Giấy",Nhân viên
DevOps Engineer,Công ty Cổ phần Công Nghệ Var Meta,"- Hà Nội: 63 Lê Văn Lương, Trung Hòa, Cầu Giấy",Nhân viên
Kỹ Sư Mạng,TỔNG CÔNG TY CÔNG NGHỆ - VIỄN THÔNG TOÀN CẦU,"- Hà Nội: 103 Nguyễn Tuân, Thanh Xuân",Nhân viên
Lập Trình Viên Java,Công ty Cổ phần Truyền thông VMG,"- Hà Nội: Tầng 6, Toà Peakview, 36 Hoàng Cầu, Đống Đa",Nhân viên
PQA Process Quality Assurance,CÔNG TY TNHH MỘT THÀNH VIÊN AN NINH MẠNG VIETTEL,"- Hà Nội: Keangnam Landmark 72, Phạm Hùng, Từ Liêm",Nhân viên
Engineer Dự Án Hà Nội,Công ty Cổ phần AVPlus,- Hà Nội,Nhân viên
Kỹ Sư Phát Triển Phần Mềm,TẬP ĐOÀN CÔNG NGHIỆP - VIỄN THÔNG QUÂN ĐỘI,"- Hà Nội: Tòa nhà Viettel Networks, ngõ 19 Duy Tân, Cầu Giấy",Nhân viên
Chuyên Viên Phân Tích Nghiệp Vụ Business Analyst,CÔNG TY CỔ PHẦN GIẢI PHÁP CÔNG NGHỆ NEWWAY,"- Hà Nội: Tầng 4, Số 74 Hồ Đền Lừ, Phường Tương Mai, Hoàng Mai",Nhân viên
Lập Trình Viên Fresher Tiếng Nhật,CÔNG TY TNHH KỸ SƯ CÔNG NGHỆ CAO VN,"- Hà Nội: 48 Tố Hữu, Nam Từ Liêm, Trung Văn, Từ Liêm",Nhân viên
Product Owner,CÔNG TY TNHH VETC DIGITAL,"- Hà Nội: Tasco Building, HH2-2, Phạm Hùng, Nam Từ Liêm",Nhân viên
Kỹ Sư Quản Lý Chất Lượng Dịch Vụ,Viettel Digital,"- Hà Nội: Keangnam Landmark 72, Nam Từ Liêm",Nhân viên
Embedded Engineer,FPT Software,"- Hồ Chí Minh: F-Town 3, 3 Võ Chí Công, Phường Long Thạnh Mỹ Ho Chi Minh City, Vietnam, Thủ Đức - Hà Nội: Tòa nhà FPT Cầu Giấy, phố Duy Tân, phường Cầu Giấy, Thành phố Hà Nội, Việt Nam, Cầu Giấy - Đà Nẵng: Tòa nhà FPT Complex, đường Nam Kỳ Khởi Nghĩa, phường Ngũ Hành Sơn, Thành phố Đà Nẵng, Việt Nam, Ngũ Hành Sơn",Nhân viên
Data Engineer,Tập đoàn FPT,"- Hà Nội: Toà FPT, số 10 Phạm Văn Bạch, Cầu Giấy",Trưởng nhóm
Business Analyst Product Analyst,CÔNG TY TNHH MỘT THÀNH VIÊN AN NINH MẠNG VIETTEL,"- Hà Nội: Keangnam Landmark 72, Phạm Hùng, Từ Liêm",Nhân viên
Python Developer,CÔNG TY CỔ PHẦN CÔNG NGHỆ ALPHAWAY,"- Hà Nội: 44 Lê Ngọc Hân, Hai Bà Trưng, Hai Bà Trưng",Trưởng nhóm
Java Software Engineer,CÔNG TY CỔ PHẦN TƯ VẤN CÔNG NGHỆ NGS,"- Hà Nội: 6th Element Nguyễn Văn Huyên, Tây Hồ, Tây Hồ",Trưởng nhóm
Data Scientist,Công ty CP Giải pháp Thanh toán Việt Nam (VNPAY),"- Hà Nội: 22 Láng Hạ, Phường Láng, Đống Đa",Nhân viên
Java Spring,CÔNG TY CỔ PHẦN TINASOFT VIỆT NAM,"- Hà Nội: Trần Hữu Dực, Nam Từ Liêm - Hà Nội: 110 trần p, Hà Đông",Nhân viên
Lập Trình Viên Web,Công ty Cổ phần MISA,"- Hà Nội: Tòa N03T1 Ngoại Giao Đoàn, Xuân Tảo, Bắc Từ Liêm - Hà Nội: Tòa Technosoft, ngõ 17, phố Duy Tân, Cầu Giấy",Nhân viên
Senior Java Developer Dự Án Chứng Khoán Cầu Giấy Hà Nội,CÔNG TY TNHH GROOO INTERNATIONAL,"- Hà Nội: Tầng 5, Tòa nhà IDMC Duy Tân, Số 21 Đường Duy Tân, Phường Cầu Giấy, Thành phố Hà Nội, Việt Nam, Cầu Giấy",Nhân viên
Nhân Viên Giám Sát,Công ty Cổ phần Tập đoàn ASG,"- Hà Nội: Khu Dịch vụ Logistics, Cảng HKQT Nội Bài, Sóc Sơn",Nhân viên
Senior JAVA Developer,CÔNG TY TNHH KỸ SƯ CÔNG NGHỆ CAO VN,"- Hà Nội: 48 Tố Hữu, Trung Văn, Nam Từ Liêm",Nhân viên
Java Developer,Alphaway Technology,- Hà Nội: Đống Đa - Hà Nội: Hai Bà Trưng,Trưởng nhóm
Scrum Master,Công Ty Cổ Phần Aggregatori Capaci,"- Hà Nội: 5BT2, khu đô thị Mễ Trì Hạ, Mễ Trì, Bắc Từ Liêm",Nhân viên
Nhân Viên Triển Khai Phần Mềm,Công ty CP Công nghệ Cyber Eye,"- Hà Nội: Tầng 3 - Tòa nhà Detech - Số 8 Đường Tôn Thất Thuyết - Mỹ Đình 2, Nam Từ Liêm",Nhân viên
Thực Tập Sinh,CÔNG TY CỔ PHẦN CÔNG NGHỆ AN NINH MẠNG QUỐC GIA VIỆT NAM,"- Hà Nội: CT2 Tràng An Complex, Số 1 Phùng Chí Kiên, Nghĩa Đô, Cầu Giấy, Cầu Giấy - Hưng Yên",Thực tập sinh
Kỹ Sư Phần Mềm,Công ty Cổ phần Tập đoàn OSB,"- Hà Nội: Tầng 6 tòa Detech Tower - Số 8, Tôn Thất Thuyết, Mỹ Đình 2, Nam Từ Liêm",Nhân viên
IT Comtor,CÔNG TY CỔ PHẦN CÔNG NGHỆ AMELA VIỆT NAM,"- Hà Nội: Tháp A Keangnam, Nam Từ Liêm",Nhân viên
DevOps Engineer,CÔNG TY CỔ PHẦN CÔNG NGHỆ TECHLAB,"- Hà Nội: Tòa Tây Hà Tower, 19 Tố Hữu, Nam Từ Liêm",Nhân viên
Engineer,Công ty Cổ phần Công nghệ và Tư vấn CIC,"- Hà Nội: 37 Lê Đại Hành, P. Lê Đại Hành, Hai Bà Trưng",Nhân viên
2D GAME ARTIST,XIPAT FLEXIBLE SOLUTIONS COMPANY LIMITED,"- Hà Nội: Tầng 8 Tòa nhà Hoa Cương, số 18 ngõ 11 Thái Hà, Trung Liệt, Đống Đa",Nhân viên
Database Administrator,Công ty TNHH Giải pháp Phân tích dữ liệu Insight Data,- Hà Nội: Cầu Giấy,Trưởng nhóm
Lập Trình Viên .NET Fullstack,CÔNG TY CỔ PHẦN CÔNG NGHỆ SANDBOXVN,"- Hà Nội: TÒA SKYLAND, N03 TRUNG YÊN 9, TRUNG HÒA, CẦU GIẤY, Cầu Giấy",Nhân viên
Business Analyst,Công ty Cổ phần MISA,"- Hà Nội: Tòa nhà Technosoft, ngõ 15 phố Duy Tân, Cầu Giấy - Hà Nội: Tòa N03T1 Ngoại Giao Đoàn- Xuân Tảo, Bắc Từ Liêm",Nhân viên
Account Manager IT,CÔNG TY CỔ PHẦN VSI,"- Hà Nội: Tòa AC Building, số 3 ngõ 78 Phố Duy Tân, Dịch Vọng Hậu, Cầu Giấy, Cầu Giấy",Nhân viên
Devops,Công ty CP Khoa học Dữ liệu,"- Hà Nội: Tầng 4, toà HH2 Yên Hoà, đường Dương Đình Nghệ, Cầu Giấy",Nhân viên
IT,Công ty CP Kinh doanh F88,"- Hà Nội: Số 5 Nguyễn Thị Duệ, Phường Yên Hòa, Cầu Giấy",Trưởng nhóm
Kiểm Thử Penetration Tester,CÔNG TY TNHH MỘT THÀNH VIÊN AN NINH MẠNG VIETTEL,"- Hà Nội: Keangnam Landmark 72, Phạm Hùng, Từ Liêm - Hồ Chí Minh: Viettel Building, 285 CMT8, p12, Quận 10",Nhân viên
Product Manager,CÔNG TY CỔ PHẦN DATAVN,- Hà Nội: Cầu Giấy,Quản lý / Giám sát
,CÔNG TY CỔ PHẦN CÔNG NGHỆ TÀI CHÍNH FINHUB,"- Hà Nội: Trung tâm đổi mới sáng tạo quốc gia, tòa NIC, số 6, ngõ 7 Tôn Thất Thuyết, Dịch Vọng, Cầu Giấy, Cầu Giấy",Trưởng nhóm
Nhân Viên Tester,CÔNG TY CỔ PHẦN TINASOFT VIỆT NAM,"- Hà Nội: 110 Trần Phú - Hà Đông, Thanh Xuân",Trưởng nhóm
Editor,Công ty TNHH D.Ragoon,"- Hà Nội: Tầng 7, Tòa D29 Phạm Văn Bạch, Cầu Giấy",Nhân viên
DevOps Engineer,Công ty Cổ phần Công nghệ KiotViet,"- Hà Nội: 1A Yết Kiêu - Phường Cửa Nam, Hoàn Kiếm",Nhân viên
Cộng Tác Viên Game Design,Công ty Cổ phần Falcon Technology,"- Hà Nội: Tòa nhà Rivera Park, 69 Đ. Vũ Trọng Phụng, Thanh Xuân",Thực tập sinh
2D Artist Game,CÔNG TY CỔ PHẦN TẬP ĐOÀN WEE,"- Hà Nội: Số 99 Trần Bình - Mỹ Đình 2 - Nam Từ Liêm, Nam Từ Liêm",Nhân viên
Chuyên Viên Phân Tích Nghiệp Vụ Business Analyst ERP,Công ty Cổ phần Đầu Tư K&G Việt Nam,"- Hà Nội: Tòa nhà sông Đà, Phạm Hùng, Nam Từ Liêm",Nhân viên
Thực Tập Sinh,Công ty TNHH Phần mềm DTS Việt Nam,"- Hà Nội: Đội Cấn, Ba Đình",Thực tập sinh
,Công ty CP FINT Việt Nam,"- Hà Nội: Toà nhà D'office, 28 Thành Thái, Dịch Vọng Hậu, Cầu Giấy",Nhân viên
Business Analyst BA,CÔNG TY CỔ PHẦN STRINGEE,"- Hà Nội: Tầng 17 VP 2, Tòa nhà Sunsquare, 21 Lê Đức Thọ, Nam Từ Liêm",Nhân viên
Fullstack Java,Công ty cổ phần Synodus,- Hà Nội: Nam Từ Liêm,Nhân viên
Thực Tập Sinh,Công ty cổ phần công nghệ Isofh,"- Hà Nội: số 35 Nguyễn Đình Chiểu- Hai Bà Trưng, Hai Bà Trưng",Thực tập sinh
Unity Developer,CÔNG TY TNHH HAPIGA VIỆT NAM,"- Hà Nội: Tòa VOV Mễ Trì, Nam Từ Liêm, Nam Từ Liêm",Nhân viên
Data Scientist,CÔNG TY CỔ PHẦN CYPHER AI LABS,"- Hà Nội: The Legend Tower, 109 Nguyen Tuan, Thanh Xuân",Nhân viên
Tech Lead,CÔNG TY TNHH MỘT THÀNH VIÊN AN NINH MẠNG VIETTEL,"- Hà Nội: Keangnam Landmark 72, Phạm Hùng, Từ Liêm",Nhân viên
Lập Trình Viên Nodejs,Công ty cổ phần giải pháp MKT,"- Hà Nội: Tầng 4, tòa nhà Stellar Garden số 35 Lê Văn Thiêm, Nhân Chín Hà Nộ, Thanh Xuân",Nhân viên
Fullstack Developer PHP Reactjs,CÔNG TY TNHH MUMESOFT INNOVATION,"- Hà Nội: Tầng 6, số 12 Mễ Trì Hạ, phường Mễ Trì, Nam Từ Liêm",Trưởng nhóm
Chuyên Viên Lập Trình Kotlin Android,Công ty Cổ phần Tập đoàn Meey Land,"- Hà Nội: 97-99 Láng Hạ, Đống Đa",Trưởng nhóm
,CÔNG TY CỔ PHẦN TINASOFT VIỆT NAM,"- Hà Nội: 110 Trần Phú - Hà Đông, Thanh Xuân",Trưởng nhóm
Lập Trình Viên Backend Python,CÔNG TY CỔ PHẦN CÔNG NGHỆ FOXAI,"- Hà Nội: Tòa nhà N03-T3, Khu Ngoại Giao Đoàn, Phường Xuân Tảo, Bắc Từ Liêm",Nhân viên
Quản Lý Dự Án,Công ty TNHH Horus Productions,"- Hà Nội: tòa CT2D - VOV - Mễ Trì, Nam Từ Liêm",Quản lý / Giám sát
Business Analyst,CÔNG TY CỔ PHẦN JARVIS GLOBAL,"- Hà Nội: Trung Hoà, Cầu Giấy, Cầu Giấy",Nhân viên
Java Developer Bank,Công ty TNHH Giải pháp Phân tích dữ liệu Insight Data,"- Hà Nội: 19-21 Vũ Trọng Phụng, Thanh Xuân, Thanh Xuân",Trưởng nhóm
Java Developer Backend Dự Án Banking,Công ty Cổ phần Tập đoàn Công nghệ Thiên Hoàng,"- Hà Nội: Tầng 22 tòa nhà Viwaseen, số 48 Tố Hữu, Trung Văn, Nam Từ Liêm, Nam Từ Liêm",Trưởng nhóm
Lập Trình Viên PHP Laravel,CÔNG TY CỔ PHẦN GIẢI PHÁP CÔNG NGHỆ NEWWAY,"- Hà Nội: Số 74 Hồ Đền Lừ, Phường Hoàng Văn Thụ, Hoàng Mai, Hoàng Mai",Nhân viên
,Công ty Cổ phần Tập đoàn Meey Land,"- Hà Nội: 97-99 Láng Hạ, Đống Đa",Trưởng nhóm
AI Engineer,Công ty TNHH TeenUp,"- Hà Nội: Số 29, ngõ 121 Thái Hà, phường Trung Liệt, Đống Đa",Trưởng nhóm
AI Engineer Kỹ Sư AI,CÔNG TY CỔ PHẦN EVERSTAR GLOBAL,"- Hà Nội: Tầng 15, tòa nhà văn phòng Discovery Complex, 302 Cầu Giấy, P.Dịch Vọng Hậu, Cầu Giấy",Nhân viên
Back End Developer Python,công ty cổ phần Data Impact,"- Hà Nội: Tầng 11 tòa nhà Hồ Gươm Plaza đường Trần Phú, Hà Đông",Nhân viên
Front-End Software Engineer ReactJS,Công Ty Cổ Phần Aggregatori Capaci,"- Hà Nội: 5BT2, khu đô thị Mễ Trì Hạ, Mễ Trì, Nam Từ Liêm",Nhân viên
,"VIỆN TÀI NGUYÊN, MÔI TRƯỜNG VÀ PHÁT TRIỂN BỀN VỮNG",- Hà Nội: Hai Bà Trưng,Nhân viên
Game Designer,Công ty Cổ phần Gapu,- Hà Nội,Trưởng nhóm
IT Support Tiếng Anh,CÔNG TY TNHH PHÁT TRIỂN CÔNG NGHỆ LAYOUTHUB,"- Hà Nội: Tầng 6, số 68 Khúc Thừa Dụ, Dịch Vọng, Cầu Giấy",Nhân viên
Project Manager,Cty TNHH Thundersoft Việt Nam,"- Hà Nội: W1 Vinhomes West Point, Đỗ Đức Dục, Từ Liêm, Từ Liêm",Trưởng nhóm
Business Analyst Phân Tích Nghiệp Vụ,CÔNG TY CỔ PHẦN TINASOFT VIỆT NAM,"- Hà Nội: Trần Hữu Dực, Nam Từ Liêm - Hà Nội: Dịch Vọng Hậu, Cầu Giấy - Hà Nội: 89 Láng Hạ, Đống Đa",Nhân viên
Chuyên Viên Phân Tích Nghiệp Vụ Business Analyst,CÔNG TY TNHH CÔNG NGHỆ EZCLOUD TOÀN CẦU,"- Hà Nội: Tầng 8, tòa nhà Ladeco, số 266 Đội Cấn, Ba Đình",Nhân viên
Quản Trị Dự Án IT Project Management,CÔNG TY CỔ PHẦN VSI,"- Hà Nội: Tòa AC Building, số 3 ngõ 78 Phố Duy Tân, Dịch Vọng Hậu, Cầu Giấy, Cầu Giấy",Nhân viên
Quality Control,Công ty Cổ phần GEM,"- Hà Nội: Tòa The Nine, số 9 Phạm Văn Đồng, Mai Dịch, Cầu Giấy",Nhân viên
Flutter Developer,Braly JSC,"- Hà Nội: Tầng 4 Tòa Garden Hill, số 99 Trần Bình, Nam Từ Liêm",Nhân viên
,Công Ty TNHH Du Lịch F5 Việt Nam,"- Hà Nội: Lô số 8, Tầng 5, Tháp B, Tòa nhà D2 Giảng Võ, P. Giảng Võ, Ba Đình",Nhân viên
Java Developer,Công ty cổ phần phần mềm ITSOL Holdings,"- Hà Nội: 15 Duy Tân, Dịch Vọng Hậu, Cầu Giấy, Cầu Giấy",Nhân viên
